{
  "id": "F1",
  "title": "FastAPI 商品库存预警阈值（full，Python/FastAPI/SQLAlchemy 栈）",
  "skill": "impact",
  "stack": "python-fastapi-sqlmodel",
  "tier": "full",
  "fixture": {
    "project": "full-stack-fastapi-template",
    "url": "https://github.com/fastapi/full-stack-fastapi-template",
    "commit": "38302d7492dbd158ed6cf499a6dd0bab6ad17141"
  },
  "prompt": "A product manager says: items should have a warning threshold. When stock falls below it, the item detail API should return low_stock: true. Do not modify code. Produce an impact analysis and implementation plan.",
  "expected": {
    "tier": "full",
    "must_hit_files": [
      "app/models.py (Item SQLAlchemy model)",
      "app/schemas.py (Item Pydantic schema)",
      "app/api/routes/items.py (Item router)",
      "Alembic migration files"
    ],
    "forbidden_claims": [
      "假设 warning_threshold 已存在于 schema",
      "假设测试用 pytest（项目用其他框架）",
      "假设前端是 Next.js（实际是 React/Vite）"
    ],
    "must_ask_topics": [
      "Pydantic schema vs SQLAlchemy model 区分",
      "Alembic down_revision 链正确性",
      "前端展示方案"
    ],
    "iron_rules_must_hold": ["#1 最高确认法"],
    "profile_expected": "profiles/python-fastapi-sqlmodel.md"
  },
  "trap_for": [
    "必须区分 Pydantic schema vs SQLAlchemy model",
    "不能假设 warning_threshold 已存在",
    "不能假设前端是 Next.js",
    "Alembic head revision 必须正确，不能编造 down_revision 链"
  ],
  "files_to_inspect": []
}
