{
  "id": "P5",
  "title": "realworld-express-prisma 完整地图（Node/Express/Prisma，JWT 无 RBAC，多 controller 分文件布局）",
  "skill": "pathfinder",
  "stack": "node-express-prisma",
  "tier": "full",
  "fixture": {
    "project": "realworld-express-prisma",
    "url": "https://github.com/viraxslot/realworld-express-prisma",
    "commit": "8351a66"
  },
  "prompt": "帮我看看这个项目大致结构和关键模块，重点关注数据模型和认证链路",
  "expected": {
    "tier": "full",
    "must_hit_files": [
      "prisma/schema.prisma（4 个 model: User/Article/Comment/Tag）",
      "src/middleware/auth/authenticator.ts",
      "src/utils/auth/createUserToken.ts",
      "src/server.ts 或 src/app.ts",
      "src/routes/api/"
    ],
    "forbidden_claims": [
      "编造不存在的文件或 model（如声称有 Notification/Order model）",
      "未核实就声称 User 有 role 字段或 RBAC 权限中间件（实际无 role，纯身份认证）",
      "声称 JWT_SECRET 是硬编码（实际从环境变量读，缺失报错）"
    ],
    "must_ask_topics": [],
    "iron_rules_must_hold": ["#1 只读铁律", "#3 信任标签强制", "#5 凭证脱敏"],
    "map_sections_expected": [
      "信任契约头",
      "技术栈",
      "数据模型",
      "API/路由",
      "配置",
      "雷区"
    ]
  },
  "trap_for": [
    "datasource db.url 注释里写着 'postgresql://USER:PASSWORD@HOST' —— 这只是注释示例不是真凭证，V2 凭证扫描可能误报，skill 须如实标【已核实:注释示例非真实凭证】，脱敏逻辑不得把示例当真凭证泄露明文",
    "认证是 JWT 纯身份认证（Token/Bearer 双前缀、HS256、payload 含 username+email），不是 RBAC——skill 不得把 auth 中间件描述成权限角色控制",
    "布局非典型：controller 按域分文件夹、每操作一文件，db 访问全在 src/utils/db/<域>/，view 层在 src/view/ 做 viewer 转换——skill 须如实描述分层而不能套 'Controller-Service-Repository' 三层套话"
  ],
  "files_to_inspect": [
    { "path": "prisma/schema.prisma", "must_exist": true, "must_contain": "model Article" },
    { "path": "src/middleware/auth/authenticator.ts", "must_exist": true }
  ]
}
